{
  "meta": {
    "proof_level": "P4_EXECUTED",
    "source_trust": "high",
    "freshness_epoch": 1779100000,
    "reproducibility": "reproducible",
    "independence": "multiple_sources"
  },
  "scope": {
    "target": "payment-api",
    "commit": "abc123",
    "branch": "main",
    "environment": "production",
    "service": "payments"
  },
  "dimensions": {
    "unit_tests_passed": true,
    "integration_tests_passed": true,
    "security_scan_clean": true,
    "rollback_available": true,
    "human_reviewed": false
  },
  "limitations": [],
  "contradictions": [],
  "evidence_refs": [
    "git_diff_abc123",
    "ci_unit_tests_789",
    "ci_integration_tests_790",
    "semgrep_scan_778",
    "rollback_plan_45",
    "review_102"
  ]
}