{
  "meta": {
    "proof_level": "P4_EXECUTED",
    "source_trust": "high",
    "freshness_epoch": 1779100000,
    "reproducibility": "reproducible",
    "independence": "multiple_sources"
  },
  "scope": {
    "target": "payment-api",
    "commit": "abc123",
    "branch": "main",
    "environment": "production",
    "service": "payments"
  },
  "dimensions": {
    "unit_tests_passed": {
      "status": "passed",
      "tool": "github_actions",
      "run_id": "ci-run-789",
      "suite": "unit"
    },
    "integration_tests_passed": {
      "status": "passed",
      "tool": "github_actions",
      "run_id": "ci-run-790",
      "suite": "integration"
    },
    "rollback_available": {
      "status": "passed",
      "artifact": "rollback-plan-45",
      "verified": true
    },
    "human_reviewed": {
      "status": "passed",
      "review_ref": "github-pr-review-102",
      "reviewer_role": "maintainer"
    }
  },
  "limitations": [],
  "contradictions": [],
  "evidence_refs": [
    "github_actions:ci-run-789:unit",
    "github_actions:ci-run-790:integration",
    "artifact:rollback-plan-45",
    "github:pr-review-102"
  ]
}
